{
  "$schema": "https://design-system-skills/schemas/figma-map.json",
  "version": 1,
  "figma": {
    "fileKey": "FIXTURE",
    "libraryName": "shadcn/ui kit (fixture ids — replace after the first real sync)",
    "lastSyncedAt": "2026-10-02T05:00:00.000Z"
  },
  "components": [
    {
      "figma": { "name": "Button", "nodeId": "1:100", "url": "https://www.figma.com/design/FIXTURE/kit?node-id=1-100" },
      "code": { "component": "Button", "import": "@/components/ui/button", "path": "src/components/ui/button.tsx", "storyId": "components-actions-button" },
      "props": [
        { "figma": { "name": "Variant", "type": "VARIANT" }, "code": { "prop": "variant" },
          "values": { "Default": "default", "Outline": "outline", "Secondary": "secondary", "Ghost": "ghost", "Destructive": "destructive", "Link": "link" } },
        { "figma": { "name": "Size", "type": "VARIANT" }, "code": { "prop": "size" },
          "values": { "Default": "default", "Extra small": "xs", "Small": "sm", "Large": "lg", "Icon": "icon" } },
        { "figma": { "name": "Label", "type": "TEXT" }, "code": { "prop": "children" } },
        { "figma": { "name": "Icon", "type": "BOOLEAN" }, "code": { "prop": "children", "transform": "leading-icon" } },
        { "figma": { "name": "State", "type": "VARIANT" }, "code": { "prop": null, "transform": "state" },
          "values": { "Default": {}, "Hover": null, "Focus": null, "Disabled": { "disabled": true } } }
      ],
      "codeConnect": { "status": "local", "templatePath": null, "publishedAt": null },
      "source": "confirmed",
      "confidence": 1,
      "notes": "Figma 'Icon' boolean adds a leading lucide icon child; code has no icon prop."
    },
    {
      "figma": { "name": "Badge", "nodeId": "1:200", "url": "https://www.figma.com/design/FIXTURE/kit?node-id=1-200" },
      "code": { "component": "Badge", "import": "@/components/ui/badge", "path": "src/components/ui/badge.tsx", "storyId": "components-data-display-badge" },
      "props": [
        { "figma": { "name": "Variant", "type": "VARIANT" }, "code": { "prop": "variant" },
          "values": { "Default": "default", "Secondary": "secondary", "Destructive": "destructive", "Outline": "outline" } },
        { "figma": { "name": "Label", "type": "TEXT" }, "code": { "prop": "children" } }
      ],
      "codeConnect": { "status": "local", "templatePath": null, "publishedAt": null },
      "source": "confirmed",
      "confidence": 1
    }
  ],
  "unmapped": [
    { "figma": { "name": "Toast", "nodeId": "4:10" }, "reason": "no equivalent component in code yet", "decision": "pending", "seenAt": "2026-10-02T05:00:00.000Z" }
  ]
}
